{
  "contract_version": "1.0.0",
  "generated_from": "docs/estate-analysis-2026-09-16.md (decisions D-01, D-05, D-07, D-16, D-17, D-18); baimetrics template-contract-v5.json; association-rules.md",
  "notes": "Storage-independent impactOS data contract. Facts live at their natural grain with a source identifier and a personal/financial classification. Demographics are recorded per person, never per company. Every money amount carries its own currency. Identity always requires a trustworthy source identifier; a display name never authorises a merge.",
  "field_classifications": [
    "identifier",
    "descriptive",
    "operational",
    "metric",
    "financial",
    "personal",
    "demographic",
    "stage"
  ],
  "value_types": {
    "money": {
      "kind": "object",
      "required_keys": ["amount", "currency"],
      "shape": {
        "amount": "number|null",
        "currency": "string (ISO 4217, e.g. CAD)"
      },
      "note": "A money field is always an object with an amount and a currency. A bare number is not a valid money value; see contract/schema/money.schema.json."
    }
  },
  "vocabularies": {
    "company_type": [
      "Startup",
      "SME",
      "Investment Fund",
      "Industry Partner",
      "Ecosystem Partner",
      "Service Provider",
      "Academia",
      "Government",
      "Non-Profit",
      "Large Corporation"
    ],
    "program_type": [
      "Accelerator",
      "Incubator",
      "Cohort",
      "Workshop",
      "Event",
      "Mentorship",
      "Other"
    ],
    "program_status": ["Active", "Completed", "Planned"],
    "membership_status": ["Active", "Graduated", "Withdrawn"],
    "funding_type": [
      "bank_credit",
      "personal",
      "friends_family",
      "government_loan",
      "government_grant",
      "angel",
      "venture_capital",
      "crowdfunding",
      "debt",
      "other"
    ],
    "interaction_type": [
      "email",
      "meeting",
      "call",
      "text_message",
      "coaching_session",
      "workshop",
      "note"
    ],
    "revenue_disclosure": ["Disclosed", "Not Disclosed", "Pre-revenue"],
    "milestone_status": ["not_started", "in_progress", "achieved", "verified"],
    "submission_channel": ["hosted_form", "email", "skill", "cli"],
    "submission_status": ["queued", "parsed", "accepted", "rejected"],
    "diverse_groups": [
      "Women",
      "Indigenous",
      "Racialized",
      "Persons with disabilities",
      "2SLGBTQ+",
      "Youth",
      "Immigrants",
      "Official Language Minority Communities"
    ]
  },
  "data_types": {
    "organisation": {
      "grain": "one row: the operator (single-organisation deployment, D-01)",
      "description": "The incubator or accelerator running this deployment. There is exactly one.",
      "identity_rule": {
        "source_identifier_required": true,
        "name_derived_forbidden": true,
        "keys": ["source_system", "source_id"],
        "description": "Identity is the operator's own stable identifier. Never derived from the organisation name."
      },
      "fields": {
        "source_system": { "type": "string", "required": true, "classification": "identifier" },
        "source_id": { "type": "string", "required": true, "unique": true, "classification": "identifier" },
        "legal_name": { "type": "string", "required": true, "classification": "descriptive" },
        "operating_name": { "type": "string", "required": false, "classification": "descriptive" },
        "website": { "type": "url", "required": false, "classification": "descriptive" },
        "country": { "type": "string", "required": false, "classification": "operational" }
      }
    },
    "company": {
      "grain": "one row per supported company",
      "description": "A direct-beneficiary company. Demographics are never stored here; they belong on the person.",
      "identity_rule": {
        "source_identifier_required": true,
        "name_derived_forbidden": true,
        "keys": ["source_system", "source_id"],
        "merge_evidence": ["source_id", "business_number", "verified_domain"],
        "description": "May merge only on a stable source id, business number, or verified domain. Name similarity alone never authorises a merge (association-rules.md)."
      },
      "fields": {
        "source_system": { "type": "string", "required": true, "classification": "identifier" },
        "source_id": { "type": "string", "required": true, "unique": true, "classification": "identifier" },
        "legal_name": { "type": "string", "required": true, "classification": "descriptive" },
        "operating_name": { "type": "string", "required": false, "classification": "descriptive" },
        "former_name": { "type": "string", "required": false, "classification": "descriptive" },
        "business_number": { "type": "string", "required": false, "classification": "identifier" },
        "verified_domain": { "type": "string", "required": false, "classification": "identifier" },
        "industry": { "type": "string", "required": false, "classification": "descriptive" },
        "company_type": { "type": "single_select", "vocabulary": "company_type", "required": false, "classification": "descriptive" },
        "city": { "type": "string", "required": false, "classification": "descriptive" },
        "province": { "type": "string", "required": false, "classification": "operational" },
        "country": { "type": "string", "required": false, "classification": "operational" },
        "website": { "type": "url", "required": false, "classification": "descriptive" },
        "year_incorporated": { "type": "year", "required": false, "classification": "operational" },
        "year_of_first_sale": { "type": "year", "required": false, "classification": "operational" }
      }
    },
    "person": {
      "grain": "one row per individual",
      "description": "A person associated with a company. Diverse-group membership is recorded here (per person), using the PacifiCan list.",
      "identity_rule": {
        "source_identifier_required": true,
        "name_derived_forbidden": true,
        "keys": ["source_system", "source_id"],
        "merge_evidence": ["source_id", "email"],
        "description": "Identity uses email when available, otherwise company plus normalised name and role; a source identifier is always required. The same email across companies stays a separate association, flagged for review, never auto-merged."
      },
      "fields": {
        "source_system": { "type": "string", "required": true, "classification": "identifier" },
        "source_id": { "type": "string", "required": true, "unique": true, "classification": "identifier" },
        "first_name": { "type": "string", "required": false, "classification": "personal" },
        "last_name": { "type": "string", "required": false, "classification": "personal" },
        "email": { "type": "email", "required": false, "classification": "personal" },
        "phone": { "type": "phone", "required": false, "classification": "personal" },
        "title": { "type": "string", "required": false, "classification": "descriptive" },
        "demographics": { "type": "multi_select", "vocabulary": "diverse_groups", "required": false, "classification": "demographic", "description": "PacifiCan diverse groups; self-identified; never inferred (D-18)." }
      }
    },
    "company_person": {
      "grain": "one row per person's role at a company",
      "description": "The single company-to-person join: role and tenure.",
      "identity_rule": {
        "source_identifier_required": true,
        "name_derived_forbidden": true,
        "keys": ["company_ref", "person_ref", "role"],
        "description": "Identity is the company, the person and the role. Both refs carry source identifiers; no name-derived linkage."
      },
      "fields": {
        "source_system": { "type": "string", "required": true, "classification": "identifier" },
        "source_id": { "type": "string", "required": true, "unique": true, "classification": "identifier" },
        "company_ref": { "type": "ref", "ref": "company", "required": true, "classification": "operational" },
        "person_ref": { "type": "ref", "ref": "person", "required": true, "classification": "operational" },
        "role": { "type": "string", "required": false, "classification": "descriptive" },
        "is_primary": { "type": "boolean", "required": false, "classification": "descriptive" },
        "start_date": { "type": "date", "required": false, "classification": "operational" },
        "end_date": { "type": "date", "required": false, "classification": "operational" }
      }
    },
    "program": {
      "grain": "one row per program",
      "description": "A program the operator runs (accelerator, cohort, workshop, etc.).",
      "identity_rule": {
        "source_identifier_required": true,
        "name_derived_forbidden": true,
        "keys": ["source_system", "source_id"],
        "description": "Identity is the operator plus the program's source identifier; normalised name is a match hint only."
      },
      "fields": {
        "source_system": { "type": "string", "required": true, "classification": "identifier" },
        "source_id": { "type": "string", "required": true, "unique": true, "classification": "identifier" },
        "name": { "type": "string", "required": true, "classification": "descriptive" },
        "description": { "type": "text", "required": false, "classification": "descriptive" },
        "program_type": { "type": "single_select", "vocabulary": "program_type", "required": false, "classification": "descriptive" },
        "start_date": { "type": "date", "required": false, "classification": "operational" },
        "end_date": { "type": "date", "required": false, "classification": "operational" },
        "status": { "type": "single_select", "vocabulary": "program_status", "required": false, "classification": "operational" }
      }
    },